20250526212655,"Hamburguer Gigante","Melhor hamburguer da cidade","Você que deseja comer o melhor hamburguer da cidade precisa ver isso","MC GORILA",Tags,upload/hamburguer.webp
20250526215724,"Ney & Dapay","Neymar na kings","Neymar se encontra com Repoil para fazer festa na Kings League",Gaules,mar,upload/1748289444neyma_depay.jpg
20250602184719,Academia,"Gaules começou a academia e perdeu cerca de 50kg","Gaules começou a academia e perdeu cerca de 50kg, Um exemplo para os gamers do Brasil","G1 COMUNICATION",gym,upload/1748882839academia.jpg
20250602184817,"Ana Castela","Ana castela faz show em Rio do sul com ingresso custando 200 reais","Ana castela faz show em Rio do sul com ingresso custando 200 reais","Emerson Zoio",PARTY,upload/1748882897anacastela.jpg
20250602184902,Invencivel,"Time da Fúria segue imbativel na kigs league, vencendo o time do Aguero","Time da Fúria segue imbativel na kigs league, vencendo o time do Aguero","Furia Sports",KGW,upload/1748882942furia.png
20250602185338,"Jovens no CS","Times de jovens do cs, grandes promessas, time histórico.","Times de jovens do cs, grandes promessas, time histórico.",HLTV,CS2,upload/1748883218cs2.jpeg
